{
  "$schema": "../schema/pack.schema.json",
  "pack_id": "tiber-fr",
  "framework": "TIBER-FR",
  "version": "0.2.0",
  "title": {
    "fr": "Bonnes pratiques TIBER-FR (guide v2, mars 2025)",
    "en": "TIBER-FR good practices (guide v2, March 2025)"
  },
  "license_note": {
    "fr": "© Banque de France. Synthèses et références uniquement. Le guide ne s'applique pas aux établissements « significant » du MSU.",
    "en": "© Banque de France. Summaries and references only. Not applicable to SSM significant institutions."
  },
  "sources": [
    {
      "id": "SRC-TIBER-FR-V2",
      "title": "TIBER-FR National Implementation Guide",
      "version": "2",
      "date": "2025-03-01",
      "url": "https://banque-france.fr/system/files/2025-03/Guide_TIBER_2025_V5.pdf",
      "checked_at": "2026-10-19"
    }
  ],
  "items": [
    {
      "id": "FR-T1",
      "nature": "good_practice",
      "matrix_ref": "FR-T1",
      "source": {
        "instrument": "TIBER-FR_V2",
        "article": "6",
        "section": "TIBER-FR process"
      },
      "phase": "cycle",
      "carriers": [
        "FE"
      ],
      "profiles": [
        "entity"
      ],
      "applies_when": {
        "all": [
          {
            "fact": "national_framework",
            "eq": "TIBER-FR"
          }
        ]
      },
      "relation": {
        "type": "restates",
        "targets": [
          "DORA-26.1"
        ]
      },
      "title": {
        "fr": "Cycle de 3 ans modulable",
        "en": "Adjustable 3-year cycle"
      },
      "summary": {
        "fr": "Un test TIBER-FR a lieu généralement dans un cycle de 3 ans, que l'autorité peut raccourcir ou allonger.",
        "en": "A TIBER-FR test is generally performed within a 3-year cycle, which the authority may shorten or extend."
      },
      "question": {
        "fr": "La date du prochain TLPT est-elle connue ?",
        "en": "Is the next TLPT date known?"
      }
    },
    {
      "id": "FR-T2",
      "nature": "good_practice",
      "matrix_ref": "FR-T2",
      "source": {
        "instrument": "TIBER-FR_V2",
        "article": "6.1",
        "section": "The preparation phase"
      },
      "phase": "preparation",
      "carriers": [
        "CT",
        "TM"
      ],
      "profiles": [
        "entity"
      ],
      "applies_when": {
        "all": [
          {
            "fact": "national_framework",
            "eq": "TIBER-FR"
          }
        ]
      },
      "relation": {
        "type": "adds"
      },
      "title": {
        "fr": "Points de suivi réguliers avec le TCT-FR",
        "en": "Regular status meetings with TCT-FR"
      },
      "summary": {
        "fr": "Après la réunion de notification, des points réguliers entre le TCT-FR et le CT suivent l'avancement de la préparation.",
        "en": "After the notification meeting, regular status updates between TCT-FR and CT track preparation."
      },
      "question": {
        "fr": "Une fréquence de point avec le TCT-FR est-elle convenue ?",
        "en": "Is a meeting cadence with TCT-FR agreed?"
      }
    },
    {
      "id": "FR-01",
      "nature": "good_practice",
      "matrix_ref": "FR-01",
      "source": {
        "instrument": "TIBER-FR_V2",
        "article": "6.1",
        "section": "The preparation phase"
      },
      "phase": "preparation",
      "carriers": [
        "MB",
        "CT"
      ],
      "profiles": [
        "entity"
      ],
      "applies_when": {
        "all": [
          {
            "fact": "national_framework",
            "eq": "TIBER-FR"
          }
        ]
      },
      "relation": {
        "type": "adds",
        "targets": [
          "RTS-9.6"
        ]
      },
      "title": {
        "fr": "Sponsor exécutif et attestation de périmètre",
        "en": "Executive sponsor and scope attestation"
      },
      "summary": {
        "fr": "Le périmètre, avec ses flags, est approuvé par un dirigeant ou un membre du conseil qui signe une attestation de périmètre. Ce sponsor porte la remédiation.",
        "en": "Scope and flags are approved by a senior executive or board member signing a scope attestation; this sponsor owns remediation."
      },
      "question": {
        "fr": "Qui est le sponsor exécutif, et a-t-il signé l'attestation de périmètre ?",
        "en": "Who is the executive sponsor, and has the scope attestation been signed?"
      }
    },
    {
      "id": "FR-02",
      "nature": "good_practice",
      "matrix_ref": "FR-02",
      "source": {
        "instrument": "TIBER-FR_V2",
        "article": "4",
        "section": "Risk management for TIBER-FR test and confidentiality"
      },
      "phase": "preparation",
      "carriers": [
        "FE"
      ],
      "profiles": [
        "entity"
      ],
      "applies_when": {
        "all": [
          {
            "fact": "national_framework",
            "eq": "TIBER-FR"
          }
        ]
      },
      "relation": {
        "type": "adds",
        "targets": [
          "RTS-5.2"
        ]
      },
      "title": {
        "fr": "Évaluation juridique indépendante",
        "en": "Independent legal assessment"
      },
      "summary": {
        "fr": "L'entité reste responsable de l'évaluation juridique et experte indépendante du test prévu. TIBER-FR interdit aussi l'extorsion, les menaces et la corruption d'employés.",
        "en": "The entity remains responsible for independent legal and expert assessment; TIBER-FR also prohibits extortion, threats and bribery."
      },
      "question": {
        "fr": "Le juridique a-t-il validé le test (droit du travail, données personnelles, intrusion physique) ?",
        "en": "Has legal validated the test (labour law, personal data, physical intrusion)?"
      }
    },
    {
      "id": "FR-03",
      "nature": "good_practice",
      "matrix_ref": "FR-03",
      "source": {
        "instrument": "TIBER-FR_V2",
        "article": "6.1.1",
        "section": "Procurement of TI and RT services"
      },
      "phase": "preparation",
      "carriers": [
        "CTL",
        "TIP",
        "RTT"
      ],
      "profiles": [
        "entity",
        "ti",
        "rt"
      ],
      "applies_when": {
        "all": [
          {
            "fact": "national_framework",
            "eq": "TIBER-FR"
          }
        ]
      },
      "relation": {
        "type": "restates",
        "targets": [
          "RTS-7.1.e.v",
          "RTS-7.1.f.v"
        ]
      },
      "title": {
        "fr": "Prestataire unique TI + RT : ressources et indépendance",
        "en": "Single TI + RT provider: resources and independence"
      },
      "summary": {
        "fr": "Un même prestataire peut assurer TI et RT s'il garantit des ressources qualifiées suffisantes et l'indépendance des équipes (la RT n'influence pas le rapport TI).",
        "en": "One provider may do TI and RT if it guarantees sufficient qualified resources and team independence (RT does not influence TI reporting)."
      },
      "question": {
        "fr": "Comment le prestataire prouve-t-il la séparation des équipes TI et RT ?",
        "en": "How does the provider evidence TI/RT team separation?"
      }
    },
    {
      "id": "FR-04",
      "nature": "national_obligation",
      "matrix_ref": "FR-04",
      "source": {
        "instrument": "TIBER-FR_V2",
        "article": "6.1.2",
        "section": "Regulatory security requirements"
      },
      "phase": "preparation",
      "carriers": [
        "CT"
      ],
      "profiles": [
        "entity",
        "ti",
        "rt"
      ],
      "applies_when": {
        "all": [
          {
            "fact": "national_framework",
            "eq": "TIBER-FR"
          },
          {
            "fact": "oiv_siiv_flags",
            "eq": true
          }
        ]
      },
      "relation": {
        "type": "adds",
        "note": {
          "fr": "Relève du droit national (LPM, règles ANSSI) relayé par le guide. Qualification juridique en attente.",
          "en": "National law (LPM, ANSSI rules) relayed by the guide; legal qualification pending."
        }
      },
      "title": {
        "fr": "Flags sur SIIV : prestataires PASSI LPM",
        "en": "Flags on SIIV: PASSI LPM providers"
      },
      "summary": {
        "fr": "Si des flags portent sur des SIIV d'un OIV, recourir à des prestataires PASSI LPM basés dans l'UE, sans sous-traitance hors PASSI LPM. Le rapport doit pouvoir être produit à l'ANSSI sur demande.",
        "en": "If flags target an OIV's SIIV systems, use EU-based PASSI LPM providers with no non-PASSI LPM subcontracting; report available to ANSSI on request."
      },
      "question": {
        "fr": "Un flag porte-t-il sur un SIIV ? Si oui, le prestataire est-il PASSI LPM ?",
        "en": "Does any flag target a SIIV? If so, is the provider PASSI LPM certified?"
      }
    },
    {
      "id": "FR-05",
      "nature": "good_practice",
      "matrix_ref": "FR-05",
      "source": {
        "instrument": "TIBER-FR_V2",
        "article": "6.2.1",
        "section": "The Threat Intelligence sub-phase"
      },
      "phase": "testing_ti",
      "carriers": [
        "TIP"
      ],
      "profiles": [
        "entity",
        "ti"
      ],
      "applies_when": {
        "all": [
          {
            "fact": "national_framework",
            "eq": "TIBER-FR"
          }
        ]
      },
      "relation": {
        "type": "adds",
        "targets": [
          "RTS-10.1"
        ]
      },
      "title": {
        "fr": "TI en 4 étapes, reconnaissance passive",
        "en": "4-step TI, passive reconnaissance"
      },
      "summary": {
        "fr": "Collecte ciblée, puis cartographie des acteurs, puis scénarios, puis passation. Pendant la TI, la reconnaissance reste passive pour ne pas être détecté.",
        "en": "Targeted collection, threat actor mapping, scenarios, handover; passive reconnaissance only during TI to avoid detection."
      },
      "question": {